{
  "id": "hubless/m1/task/0002",
  "title": "Introduce Fang-based CLI skeleton",
  "status": "PLANNED",
  "owner": null,
  "description": "Generate a Charmbracelet Fang command tree for hubless, wire it to the hexagonal application services, and document the command layout.",
  "labels": [
    "m1-cli",
    "cli"
  ],
  "links": [
    {
      "type": "doc",
      "url": "../../docs/reference/implementation-skeleton.md",
      "label": "Implementation skeleton"
    },
    {
      "type": "doc",
      "url": "../../docs/design/tui.md",
      "label": "TUI design (shared services)"
    }
  ],
  "badges": [],
  "created_at": "2025-09-18",
  "updated_at": null,
  "notes": [],
  "required_inputs": [
    {
      "resource": "../../docs/reference/implementation-skeleton.md",
      "exclusivity": "read-only",
      "notes": "Guidelines for hexagonal structure."
    },
    {
      "resource": "https://github.com/charmbracelet/fang",
      "exclusivity": "read-only"
    }
  ],
  "expected_outputs": [
    {
      "resource": "../../cmd/hubless",
      "notes": "Fang-powered CLI entry point with stub commands."
    },
    {
      "resource": "../../docs/reference/implementation-skeleton.md",
      "notes": "Updated with CLI wiring details."
    }
  ],
  "expertise": [
    "Go",
    "Charmbracelet Fang",
    "Dependency Injection"
  ],
  "dependencies": [
    "hubless/m0/task/0001"
  ]
}
